{
  "clip_id": 77,
  "platform": "vk",
  "url": "https://vk.com/clip-212781631_456239710",
  "external_id": "-212781631_456239710",
  "author": "Вероника Кромбергер | Бизнес-психология",
  "caption": null,
  "duration": 126.0,
  "thumbnail": "thumbnails/77.jpg",
  "added_at": "2026-10-20T19:00:00+07:00",
  "status": "done",
  "error": null
}